{
  "schema_version": "408-local-merchant-v1",
  "dataset_version": "408-LOCAL-1.9",
  "program": {
    "name": "408FARMERS Local",
    "region": "South Bay, California",
    "public_offer_rule": "Merchant perks stand on their own and are not conditioned on insurance activity.",
    "independent_offer_text": "Offer provided by the participating business and subject to its terms and availability. No insurance purchase or quote required.",
    "merchant_relationship_text": "Participation in 408FARMERS Local does not imply endorsement, certification, or recommendation by Farmers Insurance or 408FARMERS."
  },
  "merchants": [
    {
      "merchant_id": "fixture-eat-001",
      "name": "Pilot Eat & Drink Fixture",
      "slug": "pilot-eat-drink-fixture",
      "category": "eat-drink",
      "neighborhood": "Willow Glen",
      "city": "San Jose",
      "address_display": "Willow Glen, San Jose, CA",
      "description_short": "Fixture record used to validate the Eat & Drink merchant model before pilot activation.",
      "description_long": "This is a non-public fixture merchant used only to validate the reusable 408FARMERS Local data contract. It is not a live participating business or active offer.",
      "website_url": null,
      "instagram_url": null,
      "image": null,
      "logo": null,
      "status": "draft",
      "featured": true,
      "sort_order": 10,
      "fixture": true
    },
    {
      "merchant_id": "fixture-home-001",
      "name": "Pilot Home Fixture",
      "slug": "pilot-home-fixture",
      "category": "home",
      "neighborhood": "Cambrian",
      "city": "San Jose",
      "address_display": "Cambrian, San Jose, CA",
      "description_short": "Fixture record used to validate the Home merchant model before pilot activation.",
      "description_long": "This is a non-public fixture merchant used only to validate the reusable 408FARMERS Local data contract. It is not a live participating business or active offer.",
      "website_url": null,
      "instagram_url": null,
      "image": null,
      "logo": null,
      "status": "draft",
      "featured": false,
      "sort_order": 20,
      "fixture": true
    },
    {
      "merchant_id": "fixture-auto-001",
      "name": "Pilot Auto Fixture",
      "slug": "pilot-auto-fixture",
      "category": "auto",
      "neighborhood": "Campbell",
      "city": "Campbell",
      "address_display": "Campbell, CA",
      "description_short": "Fixture record used to validate the Auto merchant model before pilot activation.",
      "description_long": "This is a non-public fixture merchant used only to validate the reusable 408FARMERS Local data contract. It is not a live participating business or active offer.",
      "website_url": null,
      "instagram_url": null,
      "image": null,
      "logo": null,
      "status": "draft",
      "featured": false,
      "sort_order": 30,
      "fixture": true
    },
    {
      "merchant_id": "stevies-bar-grill-sj",
      "name": "Stevie's Bar & Grill",
      "slug": "stevies-bar-grill",
      "category": "eat-drink",
      "neighborhood": "Cambrian",
      "city": "San Jose",
      "address_display": "2705 Union Ave, San Jose, CA 95124",
      "description_short": "A neighborhood bar and grill in San Jose with food, drinks, and local events.",
      "description_long": "Stevie's Bar & Grill is a neighborhood bar and grill on Union Avenue in San Jose. Its 408FARMERS Local pilot perk is provided by Stevie's and remains completely separate from insurance activity.",
      "website_url": "https://www.steviesbargrill.com/",
      "instagram_url": "https://www.instagram.com/stevies_bar/",
      "image": null,
      "logo": null,
      "status": "active",
      "featured": true,
      "sort_order": 5,
      "fixture": false
    }
  ],
  "perks": [
    {
      "perk_id": "fixture-perk-eat-001",
      "merchant_id": "fixture-eat-001",
      "headline": "Fixture Eat & Drink Perk",
      "summary": "Placeholder offer used to validate the data model. Not available for redemption.",
      "terms": "Fixture only. No live merchant offer is represented by this record.",
      "start_at": null,
      "end_at": null,
      "evergreen": true,
      "status": "draft",
      "redemption_method": "show_screen",
      "independent_offer_text": "Offer provided by the participating business and subject to its terms and availability. No insurance purchase or quote required.",
      "fixture": true
    },
    {
      "perk_id": "fixture-perk-home-001",
      "merchant_id": "fixture-home-001",
      "headline": "Fixture Home Perk",
      "summary": "Placeholder offer used to validate the data model. Not available for redemption.",
      "terms": "Fixture only. No live merchant offer is represented by this record.",
      "start_at": null,
      "end_at": null,
      "evergreen": true,
      "status": "draft",
      "redemption_method": "show_screen",
      "independent_offer_text": "Offer provided by the participating business and subject to its terms and availability. No insurance purchase or quote required.",
      "fixture": true
    },
    {
      "perk_id": "fixture-perk-auto-001",
      "merchant_id": "fixture-auto-001",
      "headline": "Fixture Auto Perk",
      "summary": "Placeholder offer used to validate the data model. Not available for redemption.",
      "terms": "Fixture only. No live merchant offer is represented by this record.",
      "start_at": null,
      "end_at": null,
      "evergreen": true,
      "status": "draft",
      "redemption_method": "show_screen",
      "independent_offer_text": "Offer provided by the participating business and subject to its terms and availability. No insurance purchase or quote required.",
      "fixture": true
    },
    {
      "perk_id": "stevies-food-na-20",
      "merchant_id": "stevies-bar-grill-sj",
      "headline": "20% off food + non-alcoholic drinks",
      "summary": "Show this Local perk at Stevie's for 20% off food and non-alcoholic drinks.",
      "terms": "20% off food and non-alcoholic drinks. Offer provided by Stevie's Bar & Grill and subject to merchant terms and availability. No insurance purchase or quote required.",
      "start_at": null,
      "end_at": null,
      "evergreen": true,
      "status": "active",
      "redemption_method": "show_screen",
      "independent_offer_text": "Offer provided by the participating business and subject to its terms and availability. No insurance purchase or quote required.",
      "fixture": false
    }
  ]
}
